company_id,name,description,company_size,state,country,city,zip_code,address,url
146873,Optima Connections Limited,"Optima Connections is established as a leading Search and Recruitment consultancy specialising in the provision of high-calibre IT and Quantitative professionals to the technology and banking sectors for 30 years. Optima understands a client’s requirements and endeavours to gain a complete picture of the company culture, direction and the impact these factors have on specific opportunities. The end result is an unparalleled level of individual service, whether recruiting for a global player or innovative start-up, at graduate or director level.

We have become a trusted recruitment partner and advisor to the major names in the global market place as well as being instrumental in the growth and development of niche firms and start-ups working closely with them to acquire the best possible talent

Experienced Consultants
Fundamental to our success is our selection and training and development of recruitment consultants with a background in IT and Financial Markets. We have a culture of genuine enthusiasm for the evolution in technology and financial markets and a genuine empathy with our clients.",1,Buckinghamshire,GB,Wooburn Green,HP10 0PF,Unit 20A,https://www.linkedin.com/company/optima-connections
164008,GlobalLogic,"GlobalLogic, a Hitachi Group Company, is a full-lifecycle product development services leader that combines chip-to-cloud software engineering expertise and vertical industry experience to help our customers design, build, and deliver their next generation products and digital experiences. We expertly integrate design, complex engineering, and agile delivery capabilities to produce superior business outcomes for global brands. Headquartered in Silicon Valley, GlobalLogic operates design studios and engineering centers around the world, extending the benefits of our true global presence to customers in the telecom, automotive, healthcare, technology, media and entertainment, manufacturing, and semiconductor industries.",7,CA,US,Santa Clara,95054,2535 Augustine Drive,https://www.linkedin.com/company/globallogic
167445,italki,"What We Do
italki is the global language learning marketplace that brings students and teachers together for 1-on-1 and Group-class online language lessons. There’s nothing we’re more passionate about than helping our over 10 million language learners to become fluent in the language of their choice. Our 30,000+ teachers from 180 countries take learning beyond grammar tables and vocab lists. 

Our Vission
To help people become fluent in foreign languages by building connections with people from other cultures.

Our Mission
To build the world's best community-driven language education platform.

Who We Are
Joining italki means you’ll become part of a fast-paced tech company with a global mindset. Our team of diverse experts from 16 countries uses their wealth of knowledge and experience to bring a wide array of cultures together to build a global language learning community. We want people with a can-do, never-give-up attitude who can bring something special to the table. italki gives you space to grow both professionally and personally. We have a dynamic and fast-paced environment and are always looking for ways to improve, change and innovate. 

What We Offer
We give our team members the tools for success and provide a space to help you achieve your full potential. We love to share ideas and knowledge with one another and cultivate a culture of open discussion. 

Our Office’s Location: Shanghai, China and Madrid, Spain",2,0,ES,Madrid,0,0,https://www.linkedin.com/company/italki
210064,Genpact,"Genpact (NYSE: G) is a global professional services and solutions firm delivering outcomes that shape the future. Our 125,000+ people across 30+ countries are driven by our innate curiosity, entrepreneurial agility, and desire to create lasting value for clients. Powered by our purpose – the relentless pursuit of a world that works better for people – we serve and transform leading enterprises, including the Fortune Global 500, with our deep business and industry knowledge, digital operations services, and expertise in data, technology, and AI. 
Get to know us at genpact.com and on LinkedIn, X, YouTube, and Facebook. 


Get to know us at www.genpact.com and on the following social handles:
X: https://twitter.com/genpact
Facebook: https://www.facebook.com/ProudToBeGenpact/
Instagram: https://www.instagram.com/genpact_global/
YouTube: https://www.youtube.com/@GenpactGlobal

** Beware of fake offers**
Genpact never requires applicants to pay to be part of our hiring process.
If you receive an email asking you to purchase a starter kit, equipment, or training, or to pay to apply for a role, you can assume that the message is a scam. For more information on careers at Genpact, please visit us at https://www.genpact.com/careers",7,NY,US,New York,10036,1155,https://www.linkedin.com/company/genpact
210122,Acuvate,"Acuvate is a global software service provider with over 18 years of experience in digital solutions, accelerating enterprise-wide digital transformation with our AI accelerators. We provide solutions and services that modernize, automate and support enterprise applications, IT systems, and infrastructure.  We have a strong presence in the US, Europe, and APAC, where we serve multiple ultra-large customers with over $20B revenue. With our multi-skilled experts and packaged AI accelerators, we deliver unparalleled efficiencies and accelerate time-to-value for our customers. 

Acuvate is a pioneer in providing benchmark IT services and business-critical solutions for various verticals. We specialize in Migration & Modernization of Content, Data, Infrastructure, and Digital Workplace Solutions such as AI-powered Chatbots, Intranets, Advanced analytics, & Trade Promotion Optimization that helps in improving communication, collaboration, and productivity at an enterprise level. Our unique consultative approach helps our customers run their business efficiently, and our AI-driven managed services ensure 100% uninterrupted business operations.

Acuvate is a Microsoft Gold certified partner with Microsoft bot framework, Microsoft Azure, Office 365, SharePoint, business intelligence, advanced analytics, Power BI being our core areas of expertise. We are a preferred partner of several Fortune 500 companies and have digitally transformed more than 200 reputed enterprises worldwide and counting. Our long-term relations with our customers are a result of our commitment to the timelines, quality deliverables and are a testimony to the trust our client has in us.
",3,England,GB,London,W2 6BD,Paddington Street,https://www.linkedin.com/company/acuvate
222949,WSP,"We are one of the world’s leading professional services firms, uniting our engineering, advisory and science-based expertise to shape communities to advance humanity. ​

​From local beginnings to a globe-spanning presence today, we operate in over 50 countries and employ approximately 73,000 professionals, known as Visioneers. ​

Together they pioneer solutions and deliver innovative projects across sectors: Transport & Infrastructure, Property & Buildings, Earth & Environment, Water, Power & Energy and Mining & Metals. ​
​
Together let’s unlock potential everywhere.​

#WeAreWSP​",7,Quebec,CA,Montreal,H3H 1P9,"1600, boul. René-Lévesque ouest",https://www.linkedin.com/company/wsp
276981,Vertex Inc.,"The rapid changes taking place in today’s global business, technology, and regulatory environments are having a compounding effect on the complexity of indirect tax management and putting more pressure on the corporate tax function than ever before. This complexity demands intelligent solutions that enable businesses to satisfy tax obligations and support growth opportunities.

The Trusted Leader in Tax Technology 

We're Vertex (VERX). A pioneer in tax automation for more than 40 years. We proudly serve over 4,000 customers worldwide with distinction and provide comprehensive tax solutions that enable global businesses to transact, comply and grow with confidence. 

Our software, content and services address the increasing complexities of global commerce and compliance by reducing friction, enhancing transparency and enabling greater confidence in meeting indirect tax obligations. As a result, our software is ubiquitous within our customers’ business systems, touching nearly every line item of every transaction that an enterprise can conduct. Our software is fueled by over 300 million data-driven effective tax rules and supports indirect tax compliance in more than 19,000 jurisdictions worldwide.

We partner with the world’s most respected companies and harness their strengths to deliver the best tax technology solution to businesses across the globe. We integrate with key technology partners that span ERP, CRM, procurement, billing, POS and e-commerce platforms. We also work closely with over 50 tax, accounting and consulting firms to provide the integrated tax technology solutions. 

Our culture is the foundation of everything we do, guided by a common purpose to build trusted relationships at work, in business and in our communities. We strive to be a values-driven employer of choice who attracts, retains and inspires talented professionals to achieve their full potential. We employ over 1,100 full-time professionals today in the US, Europe and Brazil. ",5,PA,US,King of Prussia,19406,2301 Renaissance Blvd,https://www.linkedin.com/company/vertex-inc.
292819,XPT Software,"XPT (eXtreme Performance Team) Consultancy and Software Services Private Limited is incorporated with the objective to deliver technology solutions and services to global customers. XPT Software is headquartered at Bangalore – the IT hub of the world. XPT software provides services and solution for developing Innovative systems and products in the areas of Wireless communication, Network solutions, Automotive and Aerospace Domains, Health care, Consumer electronics, Multimedia and Applications. XPT Software believes in building strategic long-term customer relationships.",2,0,DE,Berlin,0,"Dahnstraße 4, 13403",https://www.linkedin.com/company/xpt-software
333967,JustAnswer,"JustAnswer (www.justanswer.com) is the world’s leading expert marketplace, connecting more than 16 million people worldwide with doctors, lawyers, and more. We are revolutionizing professional services by making fast, affordable expert help accessible to people everywhere. 

For more information about the company, please visit the JustAnswer website at www.justanswer.com.

To find out the current job openings and apply, please visit our careers page: http://ww2.justanswer.com/careers.",4,California,US,Covina,91723,440 N Barranca Ave,https://www.linkedin.com/company/justanswer
419519,Koenig Solutions Pvt. Ltd.,"Koenig Solutions: Your Trusted Training Partner 

For over 3 decades, learners have been at the heart of everything we do. Our 'I<O' emblem isn't just a logo, it symbolizes that I (us) is less than O (others), which aligns with our Kustomer (Koenig’s Customer) Obsession. 

Why Choose Koenig Solutions? 

Industry Leaders: We partner with tech titans like Microsoft, AWS, and Oracle, ensuring you receive the most up-to-date and relevant training. 

Unmatched Flexibility: We offer a variety of flexible training options to fit your busy schedule. 

Expert Guidance: Our team of over 300 experienced trainers is dedicated to your success. 

Unparalleled Course Selection: Explore over 5000 courses across diverse fields. Gain valuable insights with our free demos before you commit. 

Pioneering Innovation: We leverage AI to personalize your learning experience and introduce the unique Fluid Classroom Concept, maximizing your learning potential. 

Our Vision: Our vision is to create a more just and prosperous world by making education easily accessible for all. 

Our Mission: For over 30 years, Koenig Solutions has empowered individuals to achieve their Money, Respect, and Peace of Mind (MRP) goals. We believe everyone deserves a better life, and we equip individuals with the skills and confidence they need to get there. 

Our Learning Options: We offer a variety of learning options to cater to diverse learning styles. Choose from Live Online Classroom (ILO), Classroom Training at popular global destinations, Fly-me-a-Trainer (FMAT), or convenient Flexi (self-paced learning) options. 

Our Journey: Founded in 1993 by Mr. Rohit Aggarwal, Koenig Solutions has transformed from a local training provider to India's leading education powerhouse today, with a global presence in over 12 countries. 

Recognition: Awarded Microsoft's Learning Partner of the Year and listed in Limca Book of Records, among many others. 

Let's unlock your potential and shape your future together!",4,Haryana,IN,Gurugram,122022,"Emaar The Palm Spring Plaza,DLF Phase 5, Sector 54",https://www.linkedin.com/company/koenig-solutions
503712,ReturnPro formerly goTRG,"Solving returns for retailers, brands and 3P sellers.",5,FL,US,Miami,33180,20200 W Dixie Hwy,https://www.linkedin.com/company/returnpro1
575811,Burtch Works,"Welcome to BW (Burtch Works), where we're on a shared mission to build a world that works better for everyone. Specializing in the dynamic spheres of Data Science, AI, Machine Learning, Data Engineering, and Market Research, we're not just a recruitment agency — we're architects of the modern data and analytics landscape.

At BW, our approach blends human expertise with the efficiency of our Staffing Platform, making us uniquely equipped to navigate the fast-paced world of data. Whether you're a Fortune 50 company or a growing startup, our tailored talent solutions ensure you stay ahead in the game.

For job seekers, we're more than just a path to new opportunities. We take a personalized approach to understand your skills, ambitions, and career goals. Our aim? To connect you with roles that not only match your expertise but also propel your professional growth.

For businesses, BW is synonymous with building cutting-edge data and analytics teams. Our consultative strategy delves deep into your unique challenges, enabling us to deliver talent solutions that are not just effective but also transformative.

Our insights and market expertise have earned us accolades and recognition from Forbes and various prestigious publications. We're not just recognized experts in our field; we're pioneers shaping the future of recruitment in data and AI.

Join us at BW as we continue to forge paths in this exciting technological era. Whether you're looking to advance your career or seeking the right talent to elevate your team, we're here to make it happen.",1,IL,US,Chicago,60610,0,https://www.linkedin.com/company/burtch-works
729713,Seattle New Media,"Seattle New Media is a leading website development agency with offices in Seattle, WA and Orlando, FL.  We have more than a decade of combined experience providing future-focused solutions to world-class businesses.  We help SaaS, enterprise-level to mid-size companies build Webflow websites with beautiful Figma designs, develop and implement SEO strategies, and more.  Leveraging the efficiency of low-code and no-code platforms, we help businesses set up the necessary integrations to scale their business. ",1,Washington,US,Seattle,98107,5608 17th Ave NW,https://www.linkedin.com/company/seattle-new-media
853311,LeewayHertz ,"LeewayHertz is one of the first few companies to build and launch a commercial app on Apple's App Store. Our certified designers and developers have designed and developed over 100 digital platforms using AI, IoT, Web3, Metaverse and Blockchain technologies. At LeewayHertz, we have developed digital solutions for Fortune 500 companies and startups to ease their business functions with the latest technologies. Some of our reputed clients include ESPN, NASCAR, Hershey's, McKinsey, P&G, Siemens, 3M, Pearson and more.

Being an award-winning software development company, we have also proven our expertise in AI development, offering a comprehensive suite of AI services, including AI/ML strategy consulting, custom model and solutions development, and AI integration and deployment. Our team of certified experts specializes in advanced AI technologies such as ML, computer vision, and natural language processing. LeewayHertz's expertise extends to multiple AI models, including GPT-4, LLaMA, PaLM-2, and more. If you're looking to harness the power of AI for transformative business success, LeewayHertz is your trusted technology partner. Join us at https://www.leewayhertz.com/
",2,Haryana,IN,Gurgaon,122002,"Unitech Cyber Park, ",https://www.linkedin.com/company/leewayhertz-technologies
1046969,Lumeris,"Lumeris is a value-based care managed services operator for health systems and providers seeking extraordinary clinical and financial outcomes. Lumeris aligns providers and payers across populations with technologies, processes, behaviors and information to achieve high-quality, cost-effective care with satisfied consumers — and engaged physicians. Lumeris with Essence Healthcare, its inaugural client with more than 60,000 Medicare members in Missouri and Illinois, has averaged a CMS rating of 4.5 Stars for the last ten years and produced the highest consumer and physician satisfaction scores in the industry along with significantly better clinical outcomes and lower costs. For more information, go to www.lumeris.com.",5,Missouri,US,Maryland Heights,63043,13900 Riverport Drive,https://www.linkedin.com/company/lumeris
1412607,WSP in India,"We are one of the world’s leading professional services firms, uniting our engineering, advisory and science-based expertise to shape communities to advance humanity. 

From local beginnings to a globe-spanning presence today, we operate in over 50 countries and employ approximately 73,000 professionals, known as Visioneers.

Our India team of 4,200+ professionals pioneer solutions and deliver innovative projects across sectors: Transport & Infrastructure, Property & Buildings, Earth & Environment, Water, Power & Energy and Mining & Metals.

#WeAreWSP",7,Uttar Pradesh,IN,Noida,201301,"WSP India, FC-24, First Floor, Sector 16A,",https://www.linkedin.com/company/wsp-consultants-india-ltd
1615845,ALTEN Germany,"ALTEN Germany – Dein weltweit führender Entwicklungsdienstleister & IT Services Partner

Wer wir sind? 
Wir sind der gemeinsame Markenaufritt der deutschen Tochtergesellschaften des französischen ALTEN Konzerns. Wir entwickeln und realisieren gemeinsam Projekte von A–Z mit rund 3.000 hochqualifizierten Mitarbeitenden aus über 70 verschiedenen Nationen. Wir sind überall wo du bist – vor Ort an einem unserer 15 Standorte – bei unseren Kunden und natürlich digital vernetzt.

Wie wir arbeiten? 
Als dynamisches Team: Eigenverantwortlich, engagiert und kreativ. 
Als Tochtergesellschaften des ALTEN Konzerns profitieren wir von einem internationalen Netzwerk aus über 58.000 Kolleginnen und Kollegen sowie von über 35-jähriger Erfahrung und Know-how.

Was uns auszeichnet? 
Wir sind Multispezialist und überall dort, wo Technologie zum Leben erweckt wird. 
Unsere Projektvielfalt erstreckt sich über alle Bereiche der Forschung und Entwicklung sowohl im Engineering als auch in der digitalen Welt. Für unsere namhaften Kunden aus allen großen Industriezweigen realisieren wir Entwicklungs- und IT-Projekte entlang des gesamten Produktentstehungsprozesses – von der ersten Idee über die Konzeption und Entwicklung bis hin zum serienreifen Produkt und darüber hinaus.

Was wir bieten? 
Einen  unkomplizierten Direkteinstieg sowie unzählige Entwicklungsmöglichkeiten.
Arbeiten bei ALTEN bedeutet: Vielseitige Projekte bei namenhaften Kunden mit spannenden Aufgaben in einem kompetenten, dynamischen Team. Und damit: Beste Karriereaussichten.

Warum also ALTEN? 
Uns liegt das Wohl jedes Teammitglieds am Herzen. Deshalb legen wir Wert auf ein positives Arbeitserlebnis und gutes Betriebsklima.  Überzeuge dich also am besten selbst!

Hast du Fragen? 
Dann schreibe uns über unser Kontaktformular: https://www.alten-germany.de/kontakt/. Wir werden uns mit dir in Verbindung setzten.

Impressum: https://www.alten-germany.de/impressum/",5,0,DE,Coburg,96450,Rosenauer Straße 27,https://www.linkedin.com/company/altengermany
1646190,Aqilea,"We love technology, we love design and we love quality. Our diversity makes us unique and our inclusive workplace culture embraces individual differences by creating a sense of belonging and respect to all. With us, each individual is her/himself and respects others for who they are!
Diversity and inclusion is the part of the DNA of Soltia.

Soltia is an IT consulting company founded 2004 in Australia , 2012 in Stockholm, Sweden and 2023 in Bangalore India.

We have our own IT experts and also with 20+ years of experience in the industry a network of thousands of sub-contractors. Our consultants are at the forefront of development and strive to become even better in their areas of expertise in order to always be able to solve our customers' challenges.",2,Stockholm County,SE,Liljeholmen,11743,Fredsborgsgatan 24,https://www.linkedin.com/company/aqilea
2220694,ArsenalTech,"We’re not just another offshore software and web development company – we’re your squad of digital wizards, transforming ideas into incredible realities for clients worldwide. Armed with cutting-edge infrastructure and a young, vibrant, and jovial team full of energy, we’re on a mission to redefine custom web & mobile app development.


Meet our dream team:

>Full-Stack Ninjas slicing through code like butter
> Imaginative Designers turn ing pixels into poetry
> Savage QA Testers with eagle eyes that miss nothing
> Agile PMs who keep the chaos organized
> Wakeful Sales & Marketing Pros ready to brainstorm 24/7


Jill-Jack & master of many trades:

> Healthcare web & mobile apps that make life easier
> E-commerce platforms to turn browsing into buying
> Real estate hubs that close deals faster
> AI-powered SaaS applications smarter than your average bot
> LMS & Smart School systems that modernize education
> Logistics & shipping portals for seamless deliveries
> FinTech apps for trading, lending, and making sense of money


Platforms We Build:

> Custom Web Apps
> Mobile & Tablet Apps
> Progressive Web Apps (PWAs)
> Single Page Apps (SPAs)
> Desktop Systems


Our Core Superpowers:

> Certified Brilliance: Among the rare Indian companies with certified OutSystems developers (yes, we’re that cool).
> Global Fame: Trusted by NASDAQ-listed healthcare giants in the USA – talk about A-list credentials!
> All-in-One Expertise: From coding and design to testing and project management, we’re a one-stop shop.
> Client-First Mindset: Your success is our mission, so we offer tailored solutions that fit your goals like a glove – no cookie-cutter stuff here!
> Innovation Obsessed: Always

Our Mantra:
At ArsenalTech, we live by one rule: ""An Arsneal Of Possibilities."" Every line of code, every design mockup, every solution we deliver is built to drive growth, make an impact, and keep your business thriving.",2,Gujarat,IN,Ahmedabad,380015,"1003, 1004, B Wing, Mondeal Heights",https://www.linkedin.com/company/arsenaltech
2455773,411 Locals," 411 Locals is a leading business services agency established in 2007.
Over the past 17 years, we have successfully helped over 100,000 small businesses across the US, Canada, Mexico, and Australia bring new clients.

At 411 Locals, we value your time and talent! 

We offer flexible scheduling, the opportunity to work from home, diverse coworkers, and training programs. 

Being entrepreneurial to our core, we keep a growth mindset for our customers and employees.

As a result, 411 Locals was placed number 4 among the Local SEO US Companies in June 2019. And that’s not all. 411 Local is a Certified Google All-Stars Partner with Better Business Bureau (BBB) A+ rating and recognized by the mainstream media like Forbes, Bloomberg, Yahoo Finance, and Inc. 

If you value inclusivity, opportunity, and flexibility, we are the right place for you.

Want to be a part of a team that wants to see you succeed?
 
",5,Nevada,US,Las Vegas,89107,0,https://www.linkedin.com/company/411-locals
2653084,Asenium,"Our team offer:
Reactivity
Our knowledge, network and experience allow us to allocate qualified resources within 24–48 hours.

Global market
Thanks to office locations in Paris, Geneva, São Paulo, New York, and Singapore we cover your needs worldwide.

Expertise
Since 2005, Asenium works hand in hand with its customers for their needs of expertise throughout each phase of their transformation programs.",2,Île-de-France,FR,Paris,75017,"141, Avenue de Clichy",https://www.linkedin.com/company/asenium-consulting
3091855,Reuters News Agency,"Reuters, the news and media division of Thomson Reuters, is the world’s largest international multimedia news provider, with 2,600 journalists across 165 countries. 

Reuters News Agency offers flexible products and services that give you the freedom to experiment with the way you work. Meaning you can quickly meet the changing demands of your audience – all whilst building continued business success. ",6,UK,GB,London,E14 5EP,30 South Colonnade,https://www.linkedin.com/company/reuters-news-agency
